source_file,sheet,row_index,trait,gene,snp,chr,pos,pvalue,variety,evidence_text
literature_curated,sugar_genes,1,sugar,MdSUT1,SUT1_locus,,,,Multiple apple cultivars,"MdSUT1 is included as a curated apple sugar-accumulation gene representing sucrose transporter activity. SUT proteins mediate sucrose loading, unloading, and cellular import, connecting source-sink transport with soluble solids accumulation in fruit. Evidence type: sugar transport pathway support. Trait: sucrose content, soluble solids, sweetness."
literature_curated,sugar_genes,2,sugar,MdSUT4,SUT4_locus,,,,Multiple apple cultivars,"MdSUT4 is included as a curated sucrose transporter candidate for apple fruit sugar accumulation. It supports the RAG answer that sucrose transport into fruit cells is a central mechanism underlying soluble solids and sweetness variation. Evidence type: sugar transport pathway support. Trait: sucrose accumulation and soluble solids."
literature_curated,sugar_genes,3,sugar,MdINV,INV_locus,,,,Multiple apple cultivars,"MdINV represents apple invertase genes involved in sucrose cleavage into glucose and fructose. Invertase activity controls the balance between sucrose and hexoses and is therefore relevant to fruit sweetness and soluble sugar composition. Evidence type: sugar metabolism pathway support. Trait: sucrose metabolism, glucose/fructose accumulation, sweetness."
literature_curated,sugar_genes,4,sugar,MdSPS,SPS_locus,,,,Multiple apple cultivars,"MdSPS represents sucrose-phosphate synthase activity in apple fruit sugar metabolism. SPS catalyzes sucrose synthesis and helps explain how sucrose is regenerated and accumulated during fruit development. Evidence type: sugar metabolism pathway support. Trait: sucrose synthesis, soluble solids, sweetness."
literature_curated,sugar_genes,5,sugar,MdHXK1,HXK1_locus,,,,Multiple apple cultivars,"MdHXK1 is included as a curated hexokinase-related sugar metabolism candidate, linking hexose sensing and phosphorylation with fruit carbohydrate metabolism. Evidence type: sugar metabolism support. Trait: glucose metabolism and soluble sugar accumulation."
